{
  "$schema": "https://json-schema.org/draft/2020-12/schema",
  "$id": "https://almsivi.invalid/schemas/run-manifest.schema.json",
  "type": "object", "additionalProperties": false,
  "required": ["schema_version", "command", "inputs", "outputs", "result", "tools"],
  "properties": {
    "schema_version": {"const": 1}, "command": {"type": "array", "minItems": 1, "items": {"type": "string"}},
    "inputs": {"type": "object", "additionalProperties": {"type": "string"}},
    "outputs": {"type": "object", "additionalProperties": {"type": "string"}},
    "result": {"enum": ["success", "failure"]},
    "tools": {"type": "object", "additionalProperties": {"type": "string"}}
  }
}
