{"command":["$PYTHON","$REPOSITORY/scripts/bootstrap/bootstrap.py","bootstrap","--cache-dir","$OPENMW_CACHE","--source-dir","$OPENMW_SOURCE","--manifest","$RAW_RUN_MANIFEST"],"inputs":{"validation_commit":"3717effebb8d42ad7601d6ca02c19ac3533efcf8"},"outputs":{"cache_sha256":"dde7fdbe6bb85ca42890f73d4954fc2b8f3c6734c837a47b31bba1778f5e4395","log":"offline-bootstrap.txt","log_lines":"1","source_commit":"f4bec41444214a7903bebd178389ca22ca13f646"},"result":"success","schema_version":1,"tools":{"clang++":"Apple clang version 17.0.0 (clang-1700.4.4.1)","git":"git version 2.50.1 (Apple Git-155)","python":"3.9.6"}}
